{
  "$schema": "https://json-schema.org/draft/2020-12/schema",
  "$id": "https://xcodebuildmcp.com/schemas/structured-output/xcodebuildmcp.output.app-path/1.schema.json",
  "type": "object",
  "additionalProperties": false,
  "allOf": [
    {
      "$ref": "https://xcodebuildmcp.com/schemas/structured-output/_defs/common.schema.json#/$defs/errorConsistency"
    }
  ],
  "properties": {
    "schema": {
      "const": "xcodebuildmcp.output.app-path"
    },
    "schemaVersion": {
      "const": "1"
    },
    "didError": {
      "type": "boolean"
    },
    "error": {
      "type": [
        "string",
        "null"
      ]
    },
    "data": {
      "type": "object",
      "additionalProperties": false,
      "properties": {
        "request": {
          "$ref": "https://xcodebuildmcp.com/schemas/structured-output/_defs/common.schema.json#/$defs/appPathRequest"
        },
        "summary": {
          "type": "object",
          "additionalProperties": false,
          "properties": {
            "status": {
              "enum": [
                "SUCCEEDED",
                "FAILED"
              ]
            },
            "durationMs": {
              "type": "integer",
              "minimum": 0
            },
            "target": {
              "enum": [
                "simulator",
                "device",
                "macos",
                "swift-package"
              ]
            }
          },
          "required": [
            "status"
          ]
        },
        "artifacts": {
          "type": "object",
          "additionalProperties": false,
          "properties": {
            "appPath": {
              "type": "string"
            }
          },
          "required": [
            "appPath"
          ]
        },
        "diagnostics": {
          "$ref": "https://xcodebuildmcp.com/schemas/structured-output/_defs/common.schema.json#/$defs/basicDiagnostics"
        }
      },
      "required": [],
      "anyOf": [
        {
          "properties": {
            "artifacts": true
          },
          "required": [
            "artifacts"
          ]
        },
        {
          "properties": {
            "diagnostics": true
          },
          "required": [
            "diagnostics"
          ]
        }
      ]
    }
  },
  "required": [
    "schema",
    "schemaVersion",
    "didError",
    "error",
    "data"
  ]
}
